{
  "$schema": "../schemas/cheatsheet.schema.json",
  "schemaVersion": "1.0.0",
  "fileType": "cheatsheet",
  "languages": ["en", "te", "hi"],
  "updated": "2026-08-01",
  "description": "Browsable reference sheets for Class 5 and Class 8. Five sections each, one of every section type.",
  "sheets": [
    {
      "class": 5,
      "title": {
        "en": "Class 5 — English reference sheet",
        "te": "5వ తరగతి — ఆంగ్ల సూచిక పత్రం",
        "hi": "कक्षा 5 — अंग्रेज़ी संदर्भ पत्र"
      },
      "sections": [
        {
          "id": "c5-simple-present",
          "type": "rules",
          "category": "Grammar",
          "title": {
            "en": "Simple present tense",
            "te": "సింపుల్ ప్రెజెంట్ కాలం",
            "hi": "सिंपल प्रेज़ेंट काल"
          },
          "summary": {
            "en": "Used for habits and facts that stay true.",
            "te": "అలవాట్లకు, ఎప్పుడూ నిజమైన విషయాలకు వాడతారు.",
            "hi": "आदतों और हमेशा सच रहने वाली बातों के लिए प्रयोग होता है।"
          },
          "quizLink": { "category": "Grammar", "tags": ["tenses", "beginner"] },
          "items": [
            {
              "id": "c5-sp-1",
              "rule": {
                "en": "I / You / We / They + base verb",
                "te": "I / You / We / They + మూల క్రియ",
                "hi": "I / You / We / They + मूल क्रिया"
              },
              "examples": [
                { "en": "They play cricket on Sunday.", "te": "They play cricket on Sunday.", "hi": "They play cricket on Sunday." }
              ]
            },
            {
              "id": "c5-sp-2",
              "rule": {
                "en": "He / She / It + verb + s",
                "te": "He / She / It + క్రియ + s",
                "hi": "He / She / It + क्रिया + s"
              },
              "examples": [
                { "en": "She goes to school every day.", "te": "She goes to school every day.", "hi": "She goes to school every day." }
              ],
              "note": {
                "en": "This -s is the mistake students make most often.",
                "te": "విద్యార్థులు ఎక్కువగా పొరపాటు చేసేది ఈ -s దగ్గరే.",
                "hi": "छात्र सबसे अधिक ग़लती इसी -s में करते हैं।"
              }
            },
            {
              "id": "c5-sp-3",
              "rule": {
                "en": "Negative: do not / does not + base verb",
                "te": "నిషేధం: do not / does not + మూల క్రియ",
                "hi": "नकारात्मक: do not / does not + मूल क्रिया"
              },
              "examples": [
                { "en": "He does not eat mangoes.", "te": "He does not eat mangoes.", "hi": "He does not eat mangoes." }
              ]
            }
          ]
        },
        {
          "id": "c5-pronoun-table",
          "type": "table",
          "category": "Grammar",
          "title": {
            "en": "Pronouns with \"be\"",
            "te": "\"be\" క్రియతో సర్వనామాలు",
            "hi": "\"be\" के साथ सर्वनाम"
          },
          "quizLink": { "category": "Grammar", "tags": ["beginner", "pronouns"] },
          "columns": [
            { "en": "Pronoun", "te": "సర్వనామం", "hi": "सर्वनाम" },
            { "en": "Present", "te": "వర్తమానం", "hi": "वर्तमान" },
            { "en": "Past", "te": "భూతకాలం", "hi": "भूतकाल" }
          ],
          "rows": [
            [
              { "en": "I", "te": "నేను", "hi": "मैं" },
              { "en": "am", "te": "am", "hi": "am" },
              { "en": "was", "te": "was", "hi": "was" }
            ],
            [
              { "en": "You / We / They", "te": "నువ్వు / మేము / వాళ్ళు", "hi": "तुम / हम / वे" },
              { "en": "are", "te": "are", "hi": "are" },
              { "en": "were", "te": "were", "hi": "were" }
            ],
            [
              { "en": "He / She / It", "te": "అతను / ఆమె / అది", "hi": "वह / यह" },
              { "en": "is", "te": "is", "hi": "is" },
              { "en": "was", "te": "was", "hi": "was" }
            ]
          ]
        },
        {
          "id": "c5-core-vocabulary",
          "type": "vocab-list",
          "category": "Vocabulary Building",
          "title": {
            "en": "Words to know",
            "te": "తెలుసుకోవలసిన పదాలు",
            "hi": "जानने योग्य शब्द"
          },
          "quizLink": { "category": "Vocabulary Building", "tags": ["intermediate"] },
          "items": [
            {
              "term": { "en": "courage", "te": "ధైర్యం", "hi": "साहस" },
              "partOfSpeech": "noun",
              "example": {
                "en": "She showed great courage during the flood.",
                "te": "వరద సమయంలో ఆమె ఎంతో ధైర్యాన్ని చూపింది.",
                "hi": "बाढ़ के समय उसने बहुत साहस दिखाया।"
              },
              "sourceId": "voc-courage"
            },
            {
              "term": { "en": "gather", "te": "సేకరించు", "hi": "इकट्ठा करना" },
              "partOfSpeech": "verb",
              "sourceId": "voc-gather"
            },
            {
              "term": { "en": "generous", "te": "ఉదారమైన", "hi": "उदार" },
              "partOfSpeech": "adjective",
              "sourceId": "voc-generous"
            },
            {
              "term": { "en": "journey", "te": "ప్రయాణం", "hi": "यात्रा" },
              "partOfSpeech": "noun",
              "sourceId": "voc-journey"
            }
          ]
        },
        {
          "id": "c5-everyday-phrases",
          "type": "phrase-list",
          "category": "Phrase Learning",
          "title": {
            "en": "Everyday phrases",
            "te": "నిత్యజీవిత పదబంధాలు",
            "hi": "रोज़मर्रा के वाक्यांश"
          },
          "quizLink": { "category": "Phrase Learning", "tags": ["daily"] },
          "items": [
            {
              "phrase": { "en": "Excuse me", "te": "క్షమించండి", "hi": "सुनिए / माफ़ कीजिए" },
              "meaning": {
                "en": "a polite way to get attention or to pass by",
                "te": "దృష్టిని ఆకర్షించడానికి లేదా పక్కనుంచి వెళ్ళడానికి మర్యాదపూర్వక మాట",
                "hi": "ध्यान खींचने या पास से निकलने का विनम्र तरीका"
              },
              "register": "neutral",
              "sourceId": "phr-excuse-me"
            },
            {
              "phrase": { "en": "By the way", "te": "అన్నట్టు", "hi": "वैसे" },
              "meaning": {
                "en": "used to add something off the main topic",
                "te": "ప్రధాన విషయం కాని దాన్ని జోడించడానికి",
                "hi": "मुख्य विषय से हटकर कुछ जोड़ने के लिए"
              },
              "register": "informal",
              "sourceId": "phr-by-the-way"
            },
            {
              "phrase": { "en": "As soon as possible", "te": "వీలైనంత త్వరగా", "hi": "जितनी जल्दी हो सके" },
              "meaning": {
                "en": "at the earliest time you can manage",
                "te": "సాధ్యమైనంత తొందరగా",
                "hi": "जितना जल्दी संभव हो"
              },
              "register": "neutral",
              "sourceId": "phr-asap"
            }
          ]
        },
        {
          "id": "c5-speaking-tips",
          "type": "tips",
          "category": "Pronunciation Awareness",
          "title": {
            "en": "Sounds to watch",
            "te": "గమనించవలసిన ధ్వనులు",
            "hi": "ध्यान देने योग्य ध्वनियाँ"
          },
          "quizLink": { "category": "Pronunciation Awareness", "tags": ["beginner"] },
          "items": [
            {
              "tip": {
                "en": "\"v\" and \"w\" are different: van and won do not start alike.",
                "te": "\"v\", \"w\" వేరు వేరు: van, won ఒకేలా మొదలవవు.",
                "hi": "\"v\" और \"w\" अलग हैं: van और won की शुरुआत एक जैसी नहीं है।"
              }
            },
            {
              "tip": {
                "en": "The -ed ending is often just a /t/ or /d/ sound, not a full syllable: walked = walkt.",
                "te": "-ed చివర తరచుగా కేవలం /t/ లేదా /d/ ధ్వని మాత్రమే, పూర్తి అక్షరం కాదు: walked = walkt.",
                "hi": "-ed का अंत अक्सर सिर्फ़ /t/ या /d/ ध्वनि होता है, पूरा अक्षर नहीं: walked = walkt।"
              }
            },
            {
              "tip": {
                "en": "Say the final -s in plurals; books without the s sounds like book.",
                "te": "బహువచనంలో చివరి -s ను స్పష్టంగా పలకండి; s లేకుంటే books అనేది book లా వినిపిస్తుంది.",
                "hi": "बहुवचन में अंतिम -s बोलिए; s के बिना books, book जैसा सुनाई देता है।"
              }
            }
          ]
        }
      ]
    },
    {
      "class": 8,
      "title": {
        "en": "Class 8 — English reference sheet",
        "te": "8వ తరగతి — ఆంగ్ల సూచిక పత్రం",
        "hi": "कक्षा 8 — अंग्रेज़ी संदर्भ पत्र"
      },
      "sections": [
        {
          "id": "c8-tense-overview",
          "type": "table",
          "category": "Grammar",
          "title": {
            "en": "Tense overview",
            "te": "కాలాల సమగ్ర పట్టిక",
            "hi": "काल की सारणी"
          },
          "summary": {
            "en": "The six tenses used most often in Class 8 writing.",
            "te": "8వ తరగతి రచనలో ఎక్కువగా వాడే ఆరు కాలాలు.",
            "hi": "कक्षा 8 के लेखन में सबसे अधिक प्रयोग होने वाले छह काल।"
          },
          "quizLink": { "category": "Grammar", "tags": ["tenses", "advanced"] },
          "columns": [
            { "en": "Tense", "te": "కాలం", "hi": "काल" },
            { "en": "Form", "te": "రూపం", "hi": "रूप" },
            { "en": "Example", "te": "ఉదాహరణ", "hi": "उदाहरण" }
          ],
          "rows": [
            [
              { "en": "Simple present", "te": "సింపుల్ ప్రెజెంట్", "hi": "सिंपल प्रेज़ेंट" },
              { "en": "verb / verb + s", "te": "క్రియ / క్రియ + s", "hi": "क्रिया / क्रिया + s" },
              { "en": "She writes daily.", "te": "She writes daily.", "hi": "She writes daily." }
            ],
            [